<?xml version="1.0" encoding="UtF-8"?>
<table xmlns:xsi="http://www.w3.org/2001/XMLSchema-instance"
	xsi:noNamespaceSchemaLocation="table.xsd">
	<feedback>
		<fed_id>3001</fed_id>
		<cust_id>2001</cust_id>
		<ve_no>TN 03 A1234</ve_no>
		<ve_type>Sedan</ve_type>
		<se_da>26-JUN-14</se_da>
		<rat>8</rat>
	</feedback>
	<feedback>
		<fed_id>3002</fed_id>
		<cust_id>2001</cust_id>
		<ve_no>KA 05 K3456</ve_no>
		<ve_type>HatchBack</ve_type>
		<se_da>13-MAY-14</se_da>
		<rat>7</rat>
	</feedback>
	<feedback>
		<fed_id>3003</fed_id>
		<cust_id>2002</cust_id>
		<ve_no>MA 15 M6789</ve_no>
		<ve_type>SmallCar</ve_type>
		<se_da>20-Feb-14</se_da>
		<rat>10</rat>
	</feedback>
	<feedback>
		<fed_id>3004</fed_id>
		<cust_id>2001</cust_id>
		<ve_no>TN 07 H4567</ve_no>
		<ve_type>Luxry</ve_type>
		<se_da>26-JUN-14</se_da>
		<rat>6</rat>
	</feedback>
	<feedback>
		<fed_id>3005</fed_id>
		<cust_id>2003</cust_id>
		<ve_no>KA 12 Y5567</ve_no>
		<ve_type>SUV</ve_type>
		<se_da>17-AUG-14</se_da>
		<rat>9</rat>
	</feedback>
	<feedback>
		<fed_id>3006</fed_id>
		<cust_id>2001</cust_id>
		<ve_no>KL 09 O8989</ve_no>
		<ve_type>Compact</ve_type>
		<se_da>10-JUL-14</se_da>
		<rat>4</rat>
	</feedback>	
</table>